{
  "key": "paid-nd2fd5adb4bed",
  "audienceHeading": "こんな人のためのデータです",
  "audience": [
    {
      "strong": "自治体の企画・産業政策担当者",
      "text": "自地域の世帯収入水準を全国平均60.8万円と比較し、産業誘致資料にCSVデータを使いたい人"
    },
    {
      "strong": "地方経済・所得格差の研究者",
      "text": "東京都73.5万円と愛媛県44.6万円で1.65倍の差が生じる要因を47都道府県データで検証したい人"
    },
    {
      "strong": "出店・進出を検討するマーケティング担当者",
      "text": "世帯収入の高い地域を絞り込み、出店計画や商圏分析にPowerPoint地図とCSVを使いたい人"
    }
  ],
  "learnHeading": "このデータでわかること",
  "learn": [
    {
      "strong": "有料部分に入っているデータ形式",
      "text": "勤労者世帯の収入を47都道府県分のExcel/CSVで収録し、編集可能PowerPoint地図やSVG・KMLも付属する"
    },
    {
      "strong": "世帯収入が最も高い東京都",
      "text": "1位東京都は月収73.5万円(偏差値67.7)で、大企業や外資系企業の集中が要因"
    },
    {
      "strong": "世帯収入が最も低い愛媛県",
      "text": "最下位の愛媛県は月収44.6万円(偏差値27.3)で全国平均60.8万円を大きく下回る"
    }
  ],
  "appliedAt": "2026-09-20T04:55:04.282Z"
}
