{
  "key": "paid-naa6eba6efec2",
  "audienceHeading": "こんな人のためのデータです",
  "audience": [
    {
      "strong": "自治体の保健・健康政策担当者",
      "text": "脳血管疾患死亡率をもとに地域の健康課題を把握し、保健施策の参考にしたい人"
    },
    {
      "strong": "地域政策を分析する研究者",
      "text": "健康格差が地域によって2.6倍も生じる要因を分析したい人"
    },
    {
      "strong": "公衆衛生を学ぶ学生・研究者",
      "text": "地域差のある死亡率データを卒論・ゼミの分析テーマにしたい人"
    }
  ],
  "learnHeading": "このデータでわかること",
  "learn": [
    {
      "strong": "有料部分の収録内容",
      "text": "2022年の47都道府県分脳血管疾患死亡率データを、PowerPoint地図・Excel/CSVなど6形式で収録"
    },
    {
      "strong": "1位と最下位の実測値",
      "text": "全国平均100.1人に対し、1位秋田県は169.9人、最下位の滋賀県は66.4人で2.6倍の差"
    },
    {
      "strong": "東高西低の地域傾向",
      "text": "東北地方など東日本で死亡率が高く、近畿地方や大都市圏で低いという地理的傾向"
    }
  ],
  "appliedAt": "2026-09-20T04:52:42.926Z"
}
